,ticker,firm,sector
0,IZINV,İZ YATIRIM HOLDİNG A.Ş.,"AGRICULTURE, FORESTRY AND FISHING"
1,OZSUB,ÖZSU BALIK ÜRETİM A.Ş.,"AGRICULTURE, FORESTRY AND FISHING"
2,YAPRK,YAPRAK SÜT VE BESİ ÇİFTLİKLERİ SANAYİ VE TİCARET A.Ş.,"AGRICULTURE, FORESTRY AND FISHING"
3,ALMAD,ALTINYAĞ MADENCİLİK VE ENERJİ YATIRIMLARI SANAYİ VE TİCARET A.Ş.,MINING AND QUARRYING
4,IPEKE,İPEK DOĞAL ENERJİ KAYNAKLARI ARAŞTIRMA VE ÜRETİM A.Ş.,MINING AND QUARRYING
5,KOZAL,KOZA ALTIN İŞLETMELERİ A.Ş.,MINING AND QUARRYING
6,KOZAA,KOZA ANADOLU METAL MADENCİLİK İŞLETMELERİ A.Ş.,MINING AND QUARRYING
7,PRKME,PARK ELEKTRİK ÜRETİM MADENCİLİK SANAYİ VE TİCARET A.Ş.,MINING AND QUARRYING
8,ACSEL,ACISELSAN ACIPAYAM SELÜLOZ SANAYİ VE TİCARET A.Ş.,MANUFACTURING
9,ADEL,ADEL KALEMCİLİK TİCARET VE SANAYİ A.Ş.,MANUFACTURING
10,AFYON,AFYON ÇİMENTO SANAYİ T.A.Ş.,MANUFACTURING
11,AKCNS,AKÇANSA ÇİMENTO SANAYİ VE TİCARET A.Ş.,MANUFACTURING
12,ATEKS,AKIN TEKSTİL A.Ş.,MANUFACTURING
13,AKSA,AKSA AKRİLİK KİMYA SANAYİİ A.Ş.,MANUFACTURING
14,ALCAR,ALARKO CARRIER SANAYİ VE TİCARET A.Ş.,MANUFACTURING
15,ALKIM,ALKİM ALKALİ KİMYA A.Ş.,MANUFACTURING
16,ALKA,ALKİM KAĞIT SANAYİ VE TİCARET A.Ş.,MANUFACTURING
17,AEFES,ANADOLU EFES BİRACILIK VE MALT SANAYİİ A.Ş.,MANUFACTURING
18,ASUZU,ANADOLU ISUZU OTOMOTİV SANAYİ VE TİCARET A.Ş.,MANUFACTURING
19,ANGEN,ANATOLİA TANI VE BİYOTEKNOLOJİ ÜRÜNLERİ ARAŞTIRMA GELİŞTİRME SANAYİ VE TİCARET A.Ş.,MANUFACTURING
20,ARCLK,ARÇELİK A.Ş.,MANUFACTURING
21,ARSAN,ARSAN TEKSTİL TİCARET VE SANAYİ A.Ş.,MANUFACTURING
22,AVOD,A.V.O.D. KURUTULMUŞ GIDA VE TARIM ÜRÜNLERİ SANAYİ TİCARET A.Ş.,MANUFACTURING
23,AYES,AYES ÇELİK HASIR VE ÇİT SANAYİ A.Ş.,MANUFACTURING
24,AYGAZ,AYGAZ A.Ş.,MANUFACTURING
25,BAGFS,BAGFAŞ BANDIRMA GÜBRE FABRİKALARI A.Ş.,MANUFACTURING
26,BAKAB,BAK AMBALAJ SANAYİ VE TİCARET A.Ş.,MANUFACTURING
27,BALAT,BALATACILAR BALATACILIK SANAYİ VE TİCARET A.Ş.,MANUFACTURING
28,BNTAS,BANTAŞ BANDIRMA AMBALAJ SANAYİ TİCARET A.Ş.,MANUFACTURING
29,BANVT,BANVİT BANDIRMA VİTAMİNLİ YEM SANAYİİ A.Ş.,MANUFACTURING
30,BARMA,BAREM AMBALAJ SANAYİ VE TİCARET A.Ş.,MANUFACTURING
31,BASCM,BAŞTAŞ BAŞKENT ÇİMENTO SANAYİ VE TİCARET A.Ş.,MANUFACTURING
32,BTCIM,BATIÇİM BATI ANADOLU ÇİMENTO SANAYİİ A.Ş.,MANUFACTURING
33,BSOKE,BATISÖKE SÖKE ÇİMENTO SANAYİİ T.A.Ş.,MANUFACTURING
34,BAYRK,BAYRAK EBT TABAN SANAYİ VE TİCARET A.Ş.,MANUFACTURING
35,BRKSN,BERKOSAN YALITIM VE TECRİT MADDELERİ ÜRETİM VE TİCARET A.Ş.,MANUFACTURING
36,BLCYT,BİLİCİ YATIRIM SANAYİ VE TİCARET A.Ş.,MANUFACTURING
37,BRKO,BİRKO BİRLEŞİK KOYUNLULULAR MENSUCAT TİCARET VE SANAYİ A.Ş.,MANUFACTURING
38,BRMEN,BİRLİK MENSUCAT TİCARET VE SANAYİ İŞLETMESİ A.Ş.,MANUFACTURING
39,BMSTL,BMS BİRLEŞİK METAL SANAYİ VE TİCARET A.Ş.,MANUFACTURING
40,BMSCH,BMS ÇELİK HASIR SANAYİ VE TİCARET A.Ş.,MANUFACTURING
41,BOBET,BOĞAZİÇİ BETON SANAYİ VE TİCARET A.Ş.,MANUFACTURING
42,BRSAN,BORUSAN MANNESMANN BORU SANAYİ VE TİCARET A.Ş.,MANUFACTURING
43,BFREN,BOSCH FREN SİSTEMLERİ SANAYİ VE TİCARET A.Ş.,MANUFACTURING
44,BOSSA,BOSSA TİCARET VE SANAYİ İŞLETMELERİ T.A.Ş.,MANUFACTURING
45,BRISA,BRİSA BRIDGESTONE SABANCI LASTİK SANAYİ VE TİCARET A.Ş.,MANUFACTURING
46,BURCE,BURÇELİK BURSA ÇELİK DÖKÜM SANAYİİ A.Ş.,MANUFACTURING
47,BURVA,BURÇELİK VANA SANAYİ VE TİCARET A.Ş.,MANUFACTURING
48,BUCIM,BURSA ÇİMENTO FABRİKASI A.Ş.,MANUFACTURING
49,CCOLA,COCA-COLA İÇECEK A.Ş.,MANUFACTURING
50,CELHA,ÇELİK HALAT VE TEL SANAYİİ A.Ş.,MANUFACTURING
51,CEMAS,ÇEMAŞ DÖKÜM SANAYİ A.Ş.,MANUFACTURING
52,CEMTS,ÇEMTAŞ ÇELİK MAKİNA SANAYİ VE TİCARET A.Ş.,MANUFACTURING
53,CMBTN,ÇİMBETON HAZIRBETON VE PREFABRİK YAPI ELEMANLARI SANAYİ VE TİCARET A.Ş.,MANUFACTURING
54,CMENT,ÇİMENTAŞ İZMİR ÇİMENTO FABRİKASI T.A.Ş.,MANUFACTURING
55,CIMSA,ÇİMSA ÇİMENTO SANAYİ VE TİCARET A.Ş.,MANUFACTURING
56,CUSAN,ÇUHADAROĞLU METAL SANAYİ VE PAZARLAMA A.Ş.,MANUFACTURING
57,DAGI,DAGİ GİYİM SANAYİ VE TİCARET A.Ş.,MANUFACTURING
58,DARDL,DARDANEL ÖNENTAŞ GIDA SANAYİ A.Ş.,MANUFACTURING
59,DMSAS,DEMİSAŞ DÖKÜM EMAYE MAMÜLLERİ SANAYİ A.Ş.,MANUFACTURING
60,DERIM,DERİMOD KONFEKSİYON AYAKKABI DERİ SANAYİ VE TİCARET A.Ş.,MANUFACTURING
61,DESA,DESA DERİ SANAYİ VE TİCARET A.Ş.,MANUFACTURING
62,DEVA,DEVA HOLDİNG A.Ş.,MANUFACTURING
63,DNISI,DİNAMİK ISI MAKİNA YALITIM MALZEMELERİ SANAYİ VE TİCARET A.Ş.,MANUFACTURING
64,DIRIT,DİRİTEKS DİRİLİŞ TEKSTİL SANAYİ VE TİCARET A.Ş.,MANUFACTURING
65,DITAS,DİTAŞ DOĞAN YEDEK PARÇA İMALAT VE TEKNİK A.Ş.,MANUFACTURING
66,DGNMO,DOĞANLAR MOBİLYA GRUBU İMALAT SANAYİ VE TİCARET A.Ş.,MANUFACTURING
67,DOGUB,DOĞUSAN BORU SANAYİİ VE TİCARET A.Ş.,MANUFACTURING
68,DOKTA,DÖKTAŞ DÖKÜMCÜLÜK TİCARET VE SANAYİ A.Ş.,MANUFACTURING
69,DURDO,DURAN DOĞAN BASIM VE AMBALAJ SANAYİ A.Ş.,MANUFACTURING
70,DYOBY,DYO BOYA FABRİKALARI SANAYİ VE TİCARET A.Ş.,MANUFACTURING
71,EGEEN,EGE ENDÜSTRİ VE TİCARET A.Ş.,MANUFACTURING
72,EGGUB,EGE GÜBRE SANAYİİ A.Ş.,MANUFACTURING
73,EGPRO,EGE PROFİL TİCARET VE SANAYİ A.Ş.,MANUFACTURING
74,EGSER,EGE SERAMİK SANAYİ VE TİCARET A.Ş.,MANUFACTURING
75,EPLAS,EGEPLAST EGE PLASTİK TİCARET VE SANAYİ A.Ş.,MANUFACTURING
76,EKIZ,EKİZ KİMYA SANAYİ VE TİCARET A.Ş.,MANUFACTURING
77,ELITE,ELİTE NATUREL ORGANİK GIDA SANAYİ VE TİCARET A.Ş.,MANUFACTURING
78,EMKEL,EMEK ELEKTRİK ENDÜSTRİSİ A.Ş.,MANUFACTURING
79,EMNIS,EMİNİŞ AMBALAJ SANAYİ VE TİCARET A.Ş.,MANUFACTURING
80,ENSRI,ENSARİ DERİ GIDA SANAYİ VE TİCARET A.Ş.,MANUFACTURING
81,ERBOS,ERBOSAN ERCİYAS BORU SANAYİİ VE TİCARET A.Ş.,MANUFACTURING
82,ERCB,ERCİYAS ÇELİK BORU SANAYİ A.Ş.,MANUFACTURING
83,EREGL,EREĞLİ DEMİR VE ÇELİK FABRİKALARI T.A.Ş.,MANUFACTURING
84,ERSU,ERSU MEYVE VE GIDA SANAYİ A.Ş.,MANUFACTURING
85,TEZOL,EUROPAP TEZOL KAĞIT SANAYİ VE TİCARET A.Ş.,MANUFACTURING
86,EUREN,EUROPEN ENDÜSTRİ İNŞAAT SANAYİ VE TİCARET A.Ş.,MANUFACTURING
87,FADE,FADE GIDA YATIRIM SANAYİ TİCARET A.Ş.,MANUFACTURING
88,FMIZP,FEDERAL-MOGUL İZMİT PİSTON VE PİM ÜRETİM TESİSLERİ A.Ş.,MANUFACTURING
89,FROTO,FORD OTOMOTİV SANAYİ A.Ş.,MANUFACTURING
90,FORMT,FORMET METAL VE CAM SANAYİ A.Ş.,MANUFACTURING
91,FRIGO,FRİGO-PAK GIDA MADDELERİ SANAYİ VE TİCARET A.Ş.,MANUFACTURING
92,GEDZA,GEDİZ AMBALAJ SANAYİ VE TİCARET A.Ş.,MANUFACTURING
93,GENTS,GENTAŞ DEKORATİF YÜZEYLER SANAYİ VE TİCARET A.Ş.,MANUFACTURING
94,GEREL,GERSAN ELEKTRİK TİCARET VE SANAYİ A.Ş.,MANUFACTURING
95,GOODY,GOODYEAR LASTİKLERİ T.A.Ş.,MANUFACTURING
96,GOLTS,GÖLTAŞ GÖLLER BÖLGESİ ÇİMENTO SANAYİ VE TİCARET A.Ş.,MANUFACTURING
97,GUBRF,GÜBRE FABRİKALARI T.A.Ş.,MANUFACTURING
98,HATEK,HATEKS HATAY TEKSTİL İŞLETMELERİ A.Ş.,MANUFACTURING
99,HEKTS,HEKTAŞ TİCARET T.A.Ş.,MANUFACTURING
100,HKTM,HİDROPAR HAREKET KONTROL TEKNOLOJİLERİ MERKEZİ SANAYİ VE TİCARET A.Ş.,MANUFACTURING
101,ISKPL,IŞIK PLASTİK SANAYİ VE DIŞ TİCARET PAZARLAMA A.Ş.,MANUFACTURING
102,IHEVA,İHLAS EV ALETLERİ İMALAT SANAYİ VE TİCARET A.Ş.,MANUFACTURING
103,IMASM,İMAŞ MAKİNA SANAYİ A.Ş.,MANUFACTURING
104,ISDMR,İSKENDERUN DEMİR VE ÇELİK A.Ş.,MANUFACTURING
105,ISSEN,İŞBİR SENTETİK DOKUMA SANAYİ A.Ş.,MANUFACTURING
106,IZMDC,İZMİR DEMİR ÇELİK SANAYİ A.Ş.,MANUFACTURING
107,IZFAS,İZMİR FIRÇA SANAYİ VE TİCARET A.Ş.,MANUFACTURING
108,JANTS,JANTSA JANT SANAYİ VE TİCARET A.Ş.,MANUFACTURING
109,KLKIM,KALEKİM KİMYEVİ MADDELER SANAYİ VE TİCARET A.Ş.,MANUFACTURING
110,KAPLM,KAPLAMİN AMBALAJ SANAYİ VE TİCARET A.Ş.,MANUFACTURING
111,KRDMA,KARDEMİR KARABÜK DEMİR ÇELİK SANAYİ VE TİCARET A.Ş.,MANUFACTURING
112,KARSN,KARSAN OTOMOTİV SANAYİİ VE TİCARET A.Ş.,MANUFACTURING
113,KRTEK,KARSU TEKSTİL SANAYİİ VE TİCARET A.Ş.,MANUFACTURING
114,KARTN,KARTONSAN KARTON SANAYİ VE TİCARET A.Ş.,MANUFACTURING
115,KATMR,KATMERCİLER ARAÇ ÜSTÜ EKİPMAN SANAYİ VE TİCARET A.Ş.,MANUFACTURING
116,KENT,KENT GIDA MADDELERİ SANAYİİ VE TİCARET A.Ş.,MANUFACTURING
117,KERVT,KEREVİTAŞ GIDA SANAYİ VE TİCARET A.Ş.,MANUFACTURING
118,KRVGD,KERVAN GIDA SANAYİ VE TİCARET A.Ş.,MANUFACTURING
119,KMPUR,KİMTEKS POLİÜRETAN SANAYİ VE TİCARET A.Ş.,MANUFACTURING
120,KLMSN,KLİMASAN KLİMA SANAYİ VE TİCARET A.Ş.,MANUFACTURING
121,KCAER,KOCAER ÇELİK SANAYİ VE TİCARET A.Ş.,MANUFACTURING
122,KLSYN,KOLEKSİYON MOBİLYA SANAYİ A.Ş.,MANUFACTURING
123,KNFRT,KONFRUT GIDA SANAYİ VE TİCARET A.Ş.,MANUFACTURING
124,KONYA,KONYA ÇİMENTO SANAYİİ A.Ş.,MANUFACTURING
125,KONKA,KONYA KAĞIT SANAYİ VE TİCARET A.Ş.,MANUFACTURING
126,KORDS,KORDSA TEKNİK TEKSTİL A.Ş.,MANUFACTURING
127,KRPLS,KOROPLAST TEMİZLİK AMBALAJ ÜRÜNLERİ SANAYİ VE DIŞ TİCARET A.Ş.,MANUFACTURING
128,KRSTL,KRİSTAL KOLA VE MEŞRUBAT SANAYİ TİCARET A.Ş.,MANUFACTURING
129,KUTPO,KÜTAHYA PORSELEN SANAYİ A.Ş.,MANUFACTURING
130,KTSKR,KÜTAHYA ŞEKER FABRİKASI A.Ş.,MANUFACTURING
131,LUKSK,LÜKS KADİFE TİCARET VE SANAYİİ A.Ş.,MANUFACTURING
132,MAKIM,MAKİM MAKİNA TEKNOLOJİLERİ SANAYİ VE TİCARET A.Ş.,MANUFACTURING
133,MAKTK,MAKİNA TAKIM ENDÜSTRİSİ A.Ş.,MANUFACTURING
134,MRSHL,MARSHALL BOYA VE VERNİK SANAYİİ A.Ş.,MANUFACTURING
135,MEDTR,MEDİTERA TIBBİ MALZEME SANAYİ VE TİCARET A.Ş.,MANUFACTURING
136,MEGAP,MEGA POLİETİLEN KÖPÜK SANAYİ VE TİCARET A.Ş.,MANUFACTURING
137,MNDRS,MENDERES TEKSTİL SANAYİ VE TİCARET A.Ş.,MANUFACTURING
138,MERCN,MERCAN KİMYA SANAYİ VE TİCARET A.Ş.,MANUFACTURING
139,MERKO,MERKO GIDA SANAYİ VE TİCARET A.Ş.,MANUFACTURING
140,MNDTR,MONDİ TURKEY OLUKLU MUKAVVA KAĞIT VE AMBALAJ SANAYİ A.Ş.,MANUFACTURING
141,NIBAS,NİĞBAŞ NİĞDE BETON SANAYİ VE TİCARET A.Ş.,MANUFACTURING
142,NUHCM,NUH ÇİMENTO SANAYİ A.Ş.,MANUFACTURING
143,ORCAY,ORÇAY ORTAKÖY ÇAY SANAYİ VE TİCARET A.Ş.,MANUFACTURING
144,ORMA,ORMA ORMAN MAHSULLERİ İNTEGRE SANAYİ VE TİCARET A.Ş.,MANUFACTURING
145,OTKAR,OTOKAR OTOMOTİV VE SAVUNMA SANAYİ A.Ş.,MANUFACTURING
146,OYAKC,OYAK ÇİMENTO FABRİKALARI A.Ş.,MANUFACTURING
147,OYLUM,OYLUM SINAİ YATIRIMLAR A.Ş.,MANUFACTURING
148,OZRDN,ÖZERDEN PLASTİK SANAYİ VE TİCARET A.Ş.,MANUFACTURING
149,PNLSN,PANELSAN ÇATI CEPHE SİSTEMLERİ SANAYİ VE TİCARET A.Ş.,MANUFACTURING
150,PARSN,PARSAN MAKİNA PARÇALARI SANAYİİ A.Ş.,MANUFACTURING
151,PENGD,PENGUEN GIDA SANAYİ A.Ş.,MANUFACTURING
152,PETKM,PETKİM PETROKİMYA HOLDİNG A.Ş.,MANUFACTURING
153,PETUN,PINAR ENTEGRE ET VE UN SANAYİİ A.Ş.,MANUFACTURING
154,PINSU,PINAR SU VE İÇECEK SANAYİ VE TİCARET A.Ş.,MANUFACTURING
155,PNSUT,PINAR SÜT MAMULLERİ SANAYİİ A.Ş.,MANUFACTURING
156,POLTK,POLİTEKNİK METAL SANAYİ VE TİCARET A.Ş.,MANUFACTURING
157,PRZMA,PRİZMA PRES MATBAACILIK YAYINCILIK SANAYİ VE TİCARET A.Ş.,MANUFACTURING
158,QUAGR,QUA GRANITE HAYAL YAPI VE ÜRÜNLERİ SANAYİ TİCARET A.Ş.,MANUFACTURING
159,RNPOL,RAİNBOW POLİKARBONAT SANAYİ TİCARET A.Ş.,MANUFACTURING
160,RODRG,RODRİGO TEKSTİL SANAYİ VE TİCARET A.Ş.,MANUFACTURING
161,ROYAL,ROYAL HALI İPLİK TEKSTİL MOBİLYA SANAYİ VE TİCARET A.Ş.,MANUFACTURING
162,RTALB,RTA LABORATUVARLARI BİYOLOJİK ÜRÜNLER İLAÇ VE MAKİNE SANAYİ TİCARET A.Ş.,MANUFACTURING
163,RUBNS,RUBENİS TEKSTİL SANAYİ TİCARET A.Ş.,MANUFACTURING
164,SAFKR,SAFKAR EGE SOĞUTMACILIK KLİMA SOĞUK HAVA TESİSLERİ İHRACAT İTHALAT SANAYİ VE TİCARET A.Ş.,MANUFACTURING
165,SNICA,SANİCA ISI SANAYİ A.Ş.,MANUFACTURING
166,SANFM,SANİFOAM ENDÜSTRİ VE TÜKETİM ÜRÜNLERİ SANAYİ TİCARET A.Ş.,MANUFACTURING
167,SAMAT,SARAY MATBAACILIK KAĞITÇILIK KIRTASİYECİLİK TİCARET VE SANAYİ A.Ş.,MANUFACTURING
168,SARKY,SARKUYSAN ELEKTROLİTİK BAKIR SANAYİ VE TİCARET A.Ş.,MANUFACTURING
169,SASA,SASA POLYESTER SANAYİ A.Ş.,MANUFACTURING
170,SAYAS,SAY YENİLENEBİLİR ENERJİ EKİPMANLARI SANAYİ VE TİCARET A.Ş.,MANUFACTURING
171,SEKUR,SEKURO PLASTİK AMBALAJ SANAYİ A.Ş.,MANUFACTURING
172,SELGD,SELÇUK GIDA ENDÜSTRİ İHRACAT İTHALAT A.Ş.,MANUFACTURING
173,SELVA,SELVA GIDA SANAYİ A.Ş.,MANUFACTURING
174,SEYKM,SEYİTLER KİMYA SANAYİ A.Ş.,MANUFACTURING
175,SILVR,SİLVERLİNE ENDÜSTRİ VE TİCARET A.Ş.,MANUFACTURING
176,SODSN,SODAŞ SODYUM SANAYİİ A.Ş.,MANUFACTURING
177,SKTAS,SÖKTAŞ TEKSTİL SANAYİ VE TİCARET A.Ş.,MANUFACTURING
178,SNPAM,SÖNMEZ PAMUKLU SANAYİİ A.Ş.,MANUFACTURING
179,SUMAS,SUMAŞ SUNİ TAHTA VE MOBİLYA SANAYİ A.Ş.,MANUFACTURING
180,SUNTK,SUN TEKSTİL SANAYİ VE TİCARET A.Ş.,MANUFACTURING
181,TATGD,TAT GIDA SANAYİ A.Ş.,MANUFACTURING
182,TMPOL,TEMAPOL POLİMER PLASTİK VE İNŞAAT SANAYİ TİCARET A.Ş.,MANUFACTURING
183,TETMT,TETAMAT GIDA YATIRIMLARI A.Ş.,MANUFACTURING
184,TOASO,TOFAŞ TÜRK OTOMOBİL FABRİKASI A.Ş.,MANUFACTURING
185,TUCLK,TUĞÇELİK ALÜMİNYUM VE METAL MAMÜLLERİ SANAYİ VE TİCARET A.Ş.,MANUFACTURING
186,TUKAS,TUKAŞ GIDA SANAYİ VE TİCARET A.Ş.,MANUFACTURING
187,TRILC,TURK İLAÇ VE SERUM SANAYİ A.Ş.,MANUFACTURING
188,TMSN,TÜMOSAN MOTOR VE TRAKTÖR SANAYİ A.Ş.,MANUFACTURING
189,TUPRS,TÜPRAŞ-TÜRKİYE PETROL RAFİNERİLERİ A.Ş.,MANUFACTURING
190,PRKAB,TÜRK PRYSMİAN KABLO VE SİSTEMLERİ A.Ş.,MANUFACTURING
191,TTRAK,TÜRK TRAKTÖR VE ZİRAAT MAKİNELERİ A.Ş.,MANUFACTURING
192,TBORG,TÜRK TUBORG BİRA VE MALT SANAYİİ A.Ş.,MANUFACTURING
193,ULUSE,ULUSOY ELEKTRİK İMALAT TAAHHÜT VE TİCARET A.Ş.,MANUFACTURING
194,ULUUN,ULUSOY UN SANAYİ VE TİCARET A.Ş.,MANUFACTURING
195,USAK,UŞAK SERAMİK SANAYİ A.Ş.,MANUFACTURING
196,ULKER,ÜLKER BİSKÜVİ SANAYİ A.Ş.,MANUFACTURING
197,VANGD,VANET GIDA SANAYİ İÇ VE DIŞ TİCARET A.Ş.,MANUFACTURING
198,VESBE,VESTEL BEYAZ EŞYA SANAYİ VE TİCARET A.Ş.,MANUFACTURING
199,VESTL,VESTEL ELEKTRONİK SANAYİ VE TİCARET A.Ş.,MANUFACTURING
200,VKING,VİKİNG KAĞIT VE SELÜLOZ A.Ş.,MANUFACTURING
201,YATAS,YATAŞ YATAK VE YORGAN SANAYİ TİCARET A.Ş.,MANUFACTURING
202,YYLGD,YAYLA AGRO GIDA SANAYİ VE TİCARET A.Ş.,MANUFACTURING
203,YBTAS,YİBİTAŞ YOZGAT İŞÇİ BİRLİĞİ İNŞAAT MALZEMELERİ TİCARET VE SANAYİ A.Ş.,MANUFACTURING
204,YONGA,YONGA MOBİLYA SANAYİ VE TİCARET A.Ş.,MANUFACTURING
205,YKSLN,YÜKSELEN ÇELİK A.Ş.,MANUFACTURING
206,YUNSA,YÜNSA YÜNLÜ SANAYİ VE TİCARET A.Ş.,MANUFACTURING
207,AHGAZ,AHLATCI DOĞAL GAZ DAĞITIM ENERJİ VE YATIRIM A.Ş.,ELECTRICITY GAS AND WATER
208,AKENR,AKENERJİ ELEKTRİK ÜRETİM A.Ş.,ELECTRICITY GAS AND WATER
209,AKSEN,AKSA ENERJİ ÜRETİM A.Ş.,ELECTRICITY GAS AND WATER
210,AKSUE,AKSU ENERJİ VE TİCARET A.Ş.,ELECTRICITY GAS AND WATER
211,ALFAS,ALFA SOLAR ENERJİ SANAYİ VE TİCARET A.Ş.,ELECTRICITY GAS AND WATER
212,AYDEM,AYDEM YENİLENEBİLİR ENERJİ A.Ş.,ELECTRICITY GAS AND WATER
213,AYEN,AYEN ENERJİ A.Ş.,ELECTRICITY GAS AND WATER
214,BIOEN,BİOTREND ÇEVRE VE ENERJİ YATIRIMLARI A.Ş.,ELECTRICITY GAS AND WATER
215,CONSE,CONSUS ENERJİ İŞLETMECİLİĞİ VE HİZMETLERİ A.Ş.,ELECTRICITY GAS AND WATER
216,CANTE,ÇAN2 TERMİK A.Ş.,ELECTRICITY GAS AND WATER
217,ARASE,DOĞU ARAS ENERJİ YATIRIMLARI A.Ş.,ELECTRICITY GAS AND WATER
218,ENJSA,ENERJİSA ENERJİ A.Ş.,ELECTRICITY GAS AND WATER
219,ESEN,ESENBOĞA ELEKTRİK ÜRETİM A.Ş.,ELECTRICITY GAS AND WATER
220,GWIND,GALATA WIND ENERJİ A.Ş.,ELECTRICITY GAS AND WATER
221,HUNER,HUN YENİLENEBİLİR ENERJİ ÜRETİM A.Ş.,ELECTRICITY GAS AND WATER
222,KARYE,KARTAL YENİLENEBİLİR ENERJİ ÜRETİM A.Ş.,ELECTRICITY GAS AND WATER
223,MAGEN,MARGÜN ENERJİ ÜRETİM SANAYİ VE TİCARET A.Ş.,ELECTRICITY GAS AND WATER
224,NATEN,NATUREL YENİLENEBİLİR ENERJİ TİCARET A.Ş.,ELECTRICITY GAS AND WATER
225,NTGAZ,NATURELGAZ SANAYİ VE TİCARET A.Ş.,ELECTRICITY GAS AND WATER
226,ODAS,ODAŞ ELEKTRİK ÜRETİM SANAYİ TİCARET A.Ş.,ELECTRICITY GAS AND WATER
227,PAMEL,PAMEL YENİLENEBİLİR ELEKTRİK ÜRETİM A.Ş.,ELECTRICITY GAS AND WATER
228,SMRTG,SMART GÜNEŞ ENERJİSİ TEKNOLOJİLERİ ARAŞTIRMA GELİŞTİRME ÜRETİM SANAYİ VE TİCARET A.Ş.,ELECTRICITY GAS AND WATER
229,ZEDUR,ZEDUR ENERJİ ELEKTRİK ÜRETİM A.Ş.,ELECTRICITY GAS AND WATER
230,ZOREN,ZORLU ENERJİ ELEKTRİK ÜRETİM A.Ş.,ELECTRICITY GAS AND WATER
231,ANELE,ANEL ELEKTRİK PROJE TAAHHÜT VE TİCARET A.Ş.,CONSTRUCTION AND PUBLIC WORKS
232,BRLSM,BİRLEŞİM MÜHENDİSLİK ISITMA SOĞUTMA HAVALANDIRMA SANAYİ VE TİCARET A.Ş.,CONSTRUCTION AND PUBLIC WORKS
233,DAPGM,DAP GAYRİMENKUL GELİŞTİRME A.Ş.,CONSTRUCTION AND PUBLIC WORKS
234,EDIP,EDİP GAYRİMENKUL YATIRIM SANAYİ VE TİCARET A.Ş.,CONSTRUCTION AND PUBLIC WORKS
235,ENKAI,ENKA İNŞAAT VE SANAYİ A.Ş.,CONSTRUCTION AND PUBLIC WORKS
236,GESAN,GİRİŞİM ELEKTRİK SANAYİ TAAHHÜT VE TİCARET A.Ş.,CONSTRUCTION AND PUBLIC WORKS
237,KUYAS,KUYAŞ YATIRIM A.Ş.,CONSTRUCTION AND PUBLIC WORKS
238,ORGE,ORGE ENERJİ ELEKTRİK TAAHHÜT A.Ş.,CONSTRUCTION AND PUBLIC WORKS
239,SANEL,SAN-EL MÜHENDİSLİK ELEKTRİK TAAHHÜT SANAYİ VE TİCARET A.Ş.,CONSTRUCTION AND PUBLIC WORKS
240,TURGG,TÜRKER PROJE GAYRİMENKUL VE YATIRIM GELİŞTİRME A.Ş.,CONSTRUCTION AND PUBLIC WORKS
241,YAYLA,YAYLA ENERJİ ÜRETİM TURİZM VE İNŞAAT TİCARET A.Ş.,CONSTRUCTION AND PUBLIC WORKS
242,YYAPI,YEŞİL YAPI ENDÜSTRİSİ A.Ş.,CONSTRUCTION AND PUBLIC WORKS
243,ARZUM,ARZUM ELEKTRİKLİ EV ALETLERİ SANAYİ VE TİCARET A.Ş.,WHOLESALE AND RETAIL TRADE
244,BIMAS,BİM BİRLEŞİK MAĞAZALAR A.Ş.,WHOLESALE AND RETAIL TRADE
245,BIZIM,BİZİM TOPTAN SATIŞ MAĞAZALARI A.Ş.,WHOLESALE AND RETAIL TRADE
246,CRFSA,CARREFOURSA CARREFOUR SABANCI TİCARET MERKEZİ A.Ş.,WHOLESALE AND RETAIL TRADE
247,CASA,CASA EMTİA PETROL KİMYEVİ VE TÜREVLERİ SANAYİ TİCARET A.Ş.,WHOLESALE AND RETAIL TRADE
248,DOAS,DOĞUŞ OTOMOTİV SERVİS VE TİCARET A.Ş.,WHOLESALE AND RETAIL TRADE
249,KIMMR,ERSAN ALIŞVERİŞ HİZMETLERİ VE GIDA SANAYİ TİCARET A.Ş.,WHOLESALE AND RETAIL TRADE
250,GENIL,GEN İLAÇ VE SAĞLIK ÜRÜNLERİ SANAYİ VE TİCARET A.Ş.,WHOLESALE AND RETAIL TRADE
251,GMTAS,GİMAT MAĞAZACILIK SANAYİ VE TİCARET A.Ş.,WHOLESALE AND RETAIL TRADE
252,INTEM,İNTEMA İNŞAAT VE TESİSAT MALZEMELERİ YATIRIM VE PAZARLAMA A.Ş.,WHOLESALE AND RETAIL TRADE
253,KUVVA,KUVVA GIDA TİCARET VE SANAYİ YATIRIMLARI A.Ş.,WHOLESALE AND RETAIL TRADE
254,MAVI,MAVİ GİYİM SANAYİ VE TİCARET A.Ş.,WHOLESALE AND RETAIL TRADE
255,MEPET,MEPET METRO PETROL VE TESİSLERİ SANAYİ TİCARET A.Ş.,WHOLESALE AND RETAIL TRADE
256,MGROS,MİGROS TİCARET A.Ş.,WHOLESALE AND RETAIL TRADE
257,MIPAZ,MİLPA TİCARİ VE SINAİ ÜRÜNLER PAZARLAMA SANAYİ VE TİCARET A.Ş.,WHOLESALE AND RETAIL TRADE
258,PSDTC,PERGAMON STATUS DIŞ TİCARET A.Ş.,WHOLESALE AND RETAIL TRADE
259,SANKO,SANKO PAZARLAMA İTHALAT İHRACAT A.Ş.,WHOLESALE AND RETAIL TRADE
260,SELEC,SELÇUK ECZA DEPOSU TİCARET VE SANAYİ A.Ş.,WHOLESALE AND RETAIL TRADE
261,SUWEN,SUWEN TEKSTİL SANAYİ PAZARLAMA A.Ş.,WHOLESALE AND RETAIL TRADE
262,SOKM,ŞOK MARKETLER TİCARET A.Ş.,WHOLESALE AND RETAIL TRADE
263,TKNSA,TEKNOSA İÇ VE DIŞ TİCARET A.Ş.,WHOLESALE AND RETAIL TRADE
264,TGSAS,TGS DIŞ TİCARET A.Ş.,WHOLESALE AND RETAIL TRADE
265,UZERB,UZERTAŞ BOYA SANAYİ TİCARET VE YATIRIM A.Ş.,WHOLESALE AND RETAIL TRADE
266,VAKKO,VAKKO TEKSTİL VE HAZIR GİYİM SANAYİ İŞLETMELERİ A.Ş.,WHOLESALE AND RETAIL TRADE
267,BEYAZ,BEYAZ FİLO OTO KİRALAMA A.Ş.,TRANSPORTATION AND STORAGE
268,CLEBI,ÇELEBİ HAVA SERVİSİ A.Ş.,TRANSPORTATION AND STORAGE
269,DOCO,DO & CO AKTIENGESELLSCHAFT,TRANSPORTATION AND STORAGE
270,GSDDE,GSD DENİZCİLİK GAYRİMENKUL İNŞAAT SANAYİ VE TİCARET A.Ş.,TRANSPORTATION AND STORAGE
271,GRSEL,GÜR-SEL TURİZM TAŞIMACILIK VE SERVİS TİCARET A.Ş.,TRANSPORTATION AND STORAGE
272,PGSUS,PEGASUS HAVA TAŞIMACILIĞI A.Ş.,TRANSPORTATION AND STORAGE
273,RYSAS,REYSAŞ TAŞIMACILIK VE LOJİSTİK TİCARET A.Ş.,TRANSPORTATION AND STORAGE
274,TLMAN,TRABZON LİMAN İŞLETMECİLİĞİ A.Ş.,TRANSPORTATION AND STORAGE
275,TUREX,TUREKS TURİZM TAŞIMACILIK A.Ş.,TRANSPORTATION AND STORAGE
276,THYAO,TÜRK HAVA YOLLARI A.O.,TRANSPORTATION AND STORAGE
277,AGHOL,AG ANADOLU GRUBU HOLDİNG A.Ş.,FINANCIAL INSTITUTIONS
278,AGESA,AGESA HAYAT VE EMEKLİLİK A.Ş.,FINANCIAL INSTITUTIONS
279,AKBNK,AKBANK T.A.Ş.,FINANCIAL INSTITUTIONS
280,AKYHO,AKDENİZ YATIRIM HOLDİNG A.Ş.,FINANCIAL INSTITUTIONS
281,AKFGY,AKFEN GAYRİMENKUL YATIRIM ORTAKLIĞI A.Ş.,FINANCIAL INSTITUTIONS
282,AKSGY,AKİŞ GAYRİMENKUL YATIRIM ORTAKLIĞI A.Ş.,FINANCIAL INSTITUTIONS
283,AKMGY,AKMERKEZ GAYRİMENKUL YATIRIM ORTAKLIĞI A.Ş.,FINANCIAL INSTITUTIONS
284,AKGRT,AKSİGORTA A.Ş.,FINANCIAL INSTITUTIONS
285,ALGYO,ALARKO GAYRİMENKUL YATIRIM ORTAKLIĞI A.Ş.,FINANCIAL INSTITUTIONS
286,ALARK,ALARKO HOLDİNG A.Ş.,FINANCIAL INSTITUTIONS
287,ALBRK,ALBARAKA TÜRK KATILIM BANKASI A.Ş.,FINANCIAL INSTITUTIONS
288,ANSGR,ANADOLU ANONİM TÜRK SİGORTA ŞİRKETİ,FINANCIAL INSTITUTIONS
289,ANHYT,ANADOLU HAYAT EMEKLİLİK A.Ş.,FINANCIAL INSTITUTIONS
290,ATAGY,ATA GAYRİMENKUL YATIRIM ORTAKLIĞI A.Ş.,FINANCIAL INSTITUTIONS
291,AGYO,ATAKULE GAYRİMENKUL YATIRIM ORTAKLIĞI A.Ş.,FINANCIAL INSTITUTIONS
292,ATSYH,ATLANTİS YATIRIM HOLDİNG A.Ş.,FINANCIAL INSTITUTIONS
293,ATLAS,ATLAS MENKUL KIYMETLER YATIRIM ORTAKLIĞI A.Ş.,FINANCIAL INSTITUTIONS
294,AVGYO,AVRASYA GAYRİMENKUL YATIRIM ORTAKLIĞI A.Ş.,FINANCIAL INSTITUTIONS
295,AVHOL,AVRUPA YATIRIM HOLDİNG A.Ş.,FINANCIAL INSTITUTIONS
296,BASGZ,BAŞKENT DOĞALGAZ DAĞITIM GAYRİMENKUL YATIRIM ORTAKLIĞI A.Ş.,FINANCIAL INSTITUTIONS
297,BERA,BERA HOLDİNG A.Ş.,FINANCIAL INSTITUTIONS
298,BRKVY,BİRİKİM VARLIK YÖNETİM A.Ş.,FINANCIAL INSTITUTIONS
299,BRYAT,BORUSAN YATIRIM VE PAZARLAMA A.Ş.,FINANCIAL INSTITUTIONS
300,COSMO,COSMOS YATIRIM HOLDİNG A.Ş.,FINANCIAL INSTITUTIONS
301,CRDFA,CREDITWEST FAKTORİNG A.Ş.,FINANCIAL INSTITUTIONS
302,DAGHL,DAGİ YATIRIM HOLDİNG A.Ş.,FINANCIAL INSTITUTIONS
303,DENGE,DENGE YATIRIM HOLDİNG A.Ş.,FINANCIAL INSTITUTIONS
304,DZGYO,DENİZ GAYRİMENKUL YATIRIM ORTAKLIĞI A.Ş.,FINANCIAL INSTITUTIONS
305,DERHL,DERLÜKS YATIRIM HOLDİNG A.Ş.,FINANCIAL INSTITUTIONS
306,DOHOL,DOĞAN ŞİRKETLER GRUBU HOLDİNG A.Ş.,FINANCIAL INSTITUTIONS
307,DGGYO,DOĞUŞ GAYRİMENKUL YATIRIM ORTAKLIĞI A.Ş.,FINANCIAL INSTITUTIONS
308,ECZYT,ECZACIBAŞI YATIRIM HOLDİNG ORTAKLIĞI A.Ş.,FINANCIAL INSTITUTIONS
309,ECILC,EİS ECZACIBAŞI İLAÇ SINAİ VE FİNANSAL YATIRIMLAR SANAYİ VE TİCARET A.Ş.,FINANCIAL INSTITUTIONS
310,EKGYO,EMLAK KONUT GAYRİMENKUL YATIRIM ORTAKLIĞI A.Ş.,FINANCIAL INSTITUTIONS
311,EUKYO,EURO KAPİTAL YATIRIM ORTAKLIĞI A.Ş.,FINANCIAL INSTITUTIONS
312,EUYO,EURO MENKUL KIYMET YATIRIM ORTAKLIĞI A.Ş.,FINANCIAL INSTITUTIONS
313,ETYAT,EURO TREND YATIRIM ORTAKLIĞI A.Ş.,FINANCIAL INSTITUTIONS
314,EUHOL,EURO YATIRIM HOLDİNG A.Ş.,FINANCIAL INSTITUTIONS
315,GARFA,GARANTİ FAKTORİNG A.Ş.,FINANCIAL INSTITUTIONS
316,GRNYO,GARANTİ YATIRIM ORTAKLIĞI A.Ş.,FINANCIAL INSTITUTIONS
317,GEDIK,GEDİK YATIRIM MENKUL DEĞERLER A.Ş.,FINANCIAL INSTITUTIONS
318,GLCVY,GELECEK VARLIK YÖNETİMİ A.Ş.,FINANCIAL INSTITUTIONS
319,GLBMD,GLOBAL MENKUL DEĞERLER A.Ş.,FINANCIAL INSTITUTIONS
320,GLYHO,GLOBAL YATIRIM HOLDİNG A.Ş.,FINANCIAL INSTITUTIONS
321,GOZDE,GÖZDE GİRİŞİM SERMAYESİ YATIRIM ORTAKLIĞI A.Ş.,FINANCIAL INSTITUTIONS
322,GSDHO,GSD HOLDİNG A.Ş.,FINANCIAL INSTITUTIONS
323,GLRYH,GÜLER YATIRIM HOLDİNG A.Ş.,FINANCIAL INSTITUTIONS
324,SAHOL,HACI ÖMER SABANCI HOLDİNG A.Ş.,FINANCIAL INSTITUTIONS
325,HLGYO,HALK GAYRİMENKUL YATIRIM ORTAKLIĞI A.Ş.,FINANCIAL INSTITUTIONS
326,HDFGS,HEDEF GİRİŞİM SERMAYESİ YATIRIM ORTAKLIĞI A.Ş.,FINANCIAL INSTITUTIONS
327,HEDEF,HEDEF HOLDİNG A.Ş.,FINANCIAL INSTITUTIONS
328,HUBVC,HUB GİRİŞİM SERMAYESİ YATIRIM ORTAKLIĞI A.Ş.,FINANCIAL INSTITUTIONS
329,ICBCT,ICBC TURKEY BANK A.Ş.,FINANCIAL INSTITUTIONS
330,INVEO,INVEO YATIRIM HOLDİNG A.Ş.,FINANCIAL INSTITUTIONS
331,INVES,INVESTCO HOLDİNG A.Ş.,FINANCIAL INSTITUTIONS
332,IEYHO,IŞIKLAR ENERJİ VE YAPI HOLDİNG A.Ş.,FINANCIAL INSTITUTIONS
333,IDGYO,İDEALİST GAYRİMENKUL YATIRIM ORTAKLIĞI A.Ş.,FINANCIAL INSTITUTIONS
334,IHLAS,İHLAS HOLDİNG A.Ş.,FINANCIAL INSTITUTIONS
335,IHYAY,İHLAS YAYIN HOLDİNG A.Ş.,FINANCIAL INSTITUTIONS
336,INFO,İNFO YATIRIM MENKUL DEĞERLER A.Ş.,FINANCIAL INSTITUTIONS
337,ISFIN,İŞ FİNANSAL KİRALAMA A.Ş.,FINANCIAL INSTITUTIONS
338,ISGYO,İŞ GAYRİMENKUL YATIRIM ORTAKLIĞI A.Ş.,FINANCIAL INSTITUTIONS
339,ISGSY,İŞ GİRİŞİM SERMAYESİ YATIRIM ORTAKLIĞI A.Ş.,FINANCIAL INSTITUTIONS
340,ISMEN,İŞ YATIRIM MENKUL DEĞERLER A.Ş.,FINANCIAL INSTITUTIONS
341,ISYAT,İŞ YATIRIM ORTAKLIĞI A.Ş.,FINANCIAL INSTITUTIONS
342,ISBIR,İŞBİR HOLDİNG A.Ş.,FINANCIAL INSTITUTIONS
343,ITTFH,İTTİFAK HOLDİNG A.Ş.,FINANCIAL INSTITUTIONS
344,KERVN,KERVANSARAY YATIRIM HOLDİNG A.Ş.,FINANCIAL INSTITUTIONS
345,KZBGY,KIZILBÜK GAYRİMENKUL YATIRIM ORTAKLIĞI A.Ş.,FINANCIAL INSTITUTIONS
346,KLGYO,KİLER GAYRİMENKUL YATIRIM ORTAKLIĞI A.Ş.,FINANCIAL INSTITUTIONS
347,KLRHO,KİLER HOLDİNG A.Ş.,FINANCIAL INSTITUTIONS
348,KCHOL,KOÇ HOLDİNG A.Ş.,FINANCIAL INSTITUTIONS
349,KGYO,KORAY GAYRİMENKUL YATIRIM ORTAKLIĞI A.Ş.,FINANCIAL INSTITUTIONS
350,KRGYO,KÖRFEZ GAYRİMENKUL YATIRIM ORTAKLIĞI A.Ş.,FINANCIAL INSTITUTIONS
351,LIDFA,LİDER FAKTORİNG A.Ş.,FINANCIAL INSTITUTIONS
352,MARKA,MARKA YATIRIM HOLDİNG A.Ş.,FINANCIAL INSTITUTIONS
353,MRGYO,MARTI GAYRİMENKUL YATIRIM ORTAKLIĞI A.Ş.,FINANCIAL INSTITUTIONS
354,MZHLD,MAZHAR ZORLU HOLDİNG A.Ş.,FINANCIAL INSTITUTIONS
355,METUR,METEMTUR YATIRIM ENERJİ TURİZM VE İNŞAAT A.Ş.,FINANCIAL INSTITUTIONS
356,METRO,METRO TİCARİ VE MALİ YATIRIMLAR HOLDİNG A.Ş.,FINANCIAL INSTITUTIONS
357,MTRYO,METRO YATIRIM ORTAKLIĞI A.Ş.,FINANCIAL INSTITUTIONS
358,MSGYO,MİSTRAL GAYRİMENKUL YATIRIM ORTAKLIĞI A.Ş.,FINANCIAL INSTITUTIONS
359,MMCAS,MMC SANAYİ VE TİCARİ YATIRIMLAR A.Ş.,FINANCIAL INSTITUTIONS
360,NTHOL,NET HOLDİNG A.Ş.,FINANCIAL INSTITUTIONS
361,NUGYO,NUROL GAYRİMENKUL YATIRIM ORTAKLIĞI A.Ş.,FINANCIAL INSTITUTIONS
362,OSMEN,OSMANLI YATIRIM MENKUL DEĞERLER A.Ş.,FINANCIAL INSTITUTIONS
